{
  "schema_version": "v1",
  "response_type": "claim_pack",
  "product_boundary": "claims_and_evidence_only",
  "claim_pack_id": "15151515-1515-4151-8151-151515151515",
  "tenant_id": "11111111-1111-4111-8111-111111111111",
  "request_id": "22222222-2222-4222-8222-222222222222",
  "jurisdiction": "Municipio de La Antigua Guatemala, Sacatepéquez, Guatemala",
  "claims": [
    {
      "claim_id": "aaaaaaaa-aaaa-4aaa-8aaa-aaaaaaaaaaaa",
      "text": "Una referencia de Mixco no define por sí sola el procedimiento oficial de Antigua Guatemala.",
      "citation_refs": [
        "99999999-9999-4999-8999-999999999999"
      ],
      "evidence_status": "comparative_reference",
      "limitations": [
        "Requiere corroboración local."
      ]
    }
  ],
  "citations": [
    {
      "citation_id": "99999999-9999-4999-8999-999999999999",
      "source_id": "55555555-5555-4555-8555-555555555555",
      "document_version_id": "77777777-7777-4777-8777-777777777777",
      "section_id": "88888888-8888-4888-8888-888888888888",
      "label": "Biblioteca oficial de manuales de Mixco",
      "excerpt": "Manual de normas, procesos y procedimientos de la Dirección de Aguas y Drenajes.",
      "source_url": "https://munimixco.gob.gt/manuales/aguas-drenajes",
      "page_start": null,
      "page_end": null,
      "authority_status": "comparative",
      "jurisdiction": "Municipio de Mixco, Guatemala",
      "evidence_status": "comparative_reference"
    }
  ],
  "allowed_paraphrase_scope": {
    "mode": "faithful_paraphrase_only",
    "allowed_operations": [
      "paraphrase",
      "summarize",
      "translate"
    ],
    "content_generation_allowed": false,
    "campaign_strategy_allowed": false
  },
  "legal_disclaimer": "Este paquete conserva claims y evidencia; no genera contenido ni sustituye revisión legal.",
  "valid_until": "2026-12-31T23:59:59Z",
  "source_links": [
    "https://munimixco.gob.gt/manuales/aguas-drenajes"
  ],
  "limitations": [
    "No contiene copy, piezas, calendario editorial ni recomendaciones de campaña."
  ],
  "provenance": {
    "source_product": "la_muni_rag",
    "generated_by": "system",
    "created_at": "2026-07-18T18:00:00Z",
    "source_refs": [
      "mixco-mnpp-aguas-drenajes"
    ],
    "credential_id": "33333333-3333-4333-8333-333333333333",
    "audit_id": "44444444-4444-4444-8444-444444444444"
  }
}
